Reading OpenROAD database at '/home/kyouma-hououin/Documents/VLSI/verilog/adc_controller/librelane/runs/RUN_2025-12-06_20-03-52/38-openroad-globalrouting/spi_adc.odb'…
Reading library file at '/home/kyouma-hououin/pdk/ciel/sky130/versions/0fe599b2afb6708d281543108caf8310912f54af/sky130A/libs.ref/sky130_fd_sc_hd/lib/sky130_fd_sc_hd__tt_025C_1v80.lib'…
Reading design constraints file at '/nix/store/j0zxygszwgin6pwkx80mnja2sn8pcc6d-python3-3.11.9-env/lib/python3.11/site-packages/librelane/scripts/base.sdc'…
[INFO] Using clock sys_clk…
[INFO] Setting output delay to: 4.0
[INFO] Setting input delay to: 4.0
[INFO] Setting load to: 0.033442
[INFO] Setting clock uncertainty to: 0.25
[INFO] Setting clock transition to: 0.1499999999999999944488848768742172978818416595458984375
[INFO] Setting timing derate to: 5%
[INFO] Setting signal min routing layer to: met1 and clock min routing layer to met1. 
[INFO] Setting signal max routing layer to: met5 and clock max routing layer to met5. 
-congestion_iterations 50 -verbose
[INFO GRT-0020] Min routing layer: met1
[INFO GRT-0021] Max routing layer: met5
[INFO GRT-0022] Global adjustment: 30%
[INFO GRT-0023] Grid origin: (0, 0)
[INFO GRT-0043] No OR_DEFAULT vias defined.
[INFO GRT-0088] Layer li1     Track-Pitch = 0.4600  line-2-Via Pitch: 0.3400
[INFO GRT-0088] Layer met1    Track-Pitch = 0.3400  line-2-Via Pitch: 0.3400
[INFO GRT-0088] Layer met2    Track-Pitch = 0.4600  line-2-Via Pitch: 0.3500
[INFO GRT-0088] Layer met3    Track-Pitch = 0.6800  line-2-Via Pitch: 0.6150
[INFO GRT-0088] Layer met4    Track-Pitch = 0.9200  line-2-Via Pitch: 1.0400
[INFO GRT-0088] Layer met5    Track-Pitch = 3.4000  line-2-Via Pitch: 3.1100
[INFO GRT-0019] Found 10 clock nets.
[INFO GRT-0001] Minimum degree: 2
[INFO GRT-0002] Maximum degree: 21
[INFO GRT-0003] Macros: 0
[INFO GRT-0043] No OR_DEFAULT vias defined.
[INFO GRT-0004] Blockages: 1939

[INFO GRT-0053] Routing resources analysis:
          Routing      Original      Derated      Resource
Layer     Direction    Resources     Resources    Reduction (%)
---------------------------------------------------------------
li1        Vertical            0             0          0.00%
met1       Horizontal       7214          3372          53.26%
met2       Vertical         5610          3528          37.11%
met3       Horizontal       3598          2380          33.85%
met4       Vertical         2292          1393          39.22%
met5       Horizontal        716           340          52.51%
---------------------------------------------------------------

[INFO GRT-0197] Via related to pin nodes: 2844
[INFO GRT-0198] Via related Steiner nodes: 59
[INFO GRT-0199] Via filling finished.
[INFO GRT-0111] Final number of vias: 3473
[INFO GRT-0112] Final usage 3D: 12130

[INFO GRT-0096] Final congestion report:
Layer         Resource        Demand        Usage (%)    Max H / Max V / Total Overflow
---------------------------------------------------------------------------------------
li1                  0             0            0.00%             0 /  0 /  0
met1              3372           846           25.09%             0 /  0 /  0
met2              3528           842           23.87%             0 /  0 /  0
met3              2380             5            0.21%             0 /  0 /  0
met4              1393            18            1.29%             0 /  0 /  0
met5               340             0            0.00%             0 /  0 /  0
---------------------------------------------------------------------------------------
Total            11013          1711           15.54%             0 /  0 /  0

[INFO GRT-0018] Total wirelength: 20541 um
[INFO GRT-0014] Routed nets: 568
[INFO GRT-0006] Repairing antennas, iteration 1.
[INFO GRT-0043] No OR_DEFAULT vias defined.
[INFO GRT-0012] Found 0 antenna violations.
Placement Analysis
---------------------------------
total displacement          0.0 u
average displacement        0.0 u
max displacement            0.0 u
original HPWL           10481.1 u
legalized HPWL          10906.4 u
delta HPWL                    4 %

[INFO DPL-0020] Mirrored 204 instances
[INFO DPL-0021] HPWL before           10906.4 u
[INFO DPL-0022] HPWL after            10481.1 u
[INFO DPL-0023] HPWL delta               -3.9 %
-congestion_iterations 50 -verbose
[INFO GRT-0020] Min routing layer: met1
[INFO GRT-0021] Max routing layer: met5
[INFO GRT-0022] Global adjustment: 30%
[INFO GRT-0023] Grid origin: (0, 0)
[INFO GRT-0043] No OR_DEFAULT vias defined.
[INFO GRT-0088] Layer li1     Track-Pitch = 0.4600  line-2-Via Pitch: 0.3400
[INFO GRT-0088] Layer met1    Track-Pitch = 0.3400  line-2-Via Pitch: 0.3400
[INFO GRT-0088] Layer met2    Track-Pitch = 0.4600  line-2-Via Pitch: 0.3500
[INFO GRT-0088] Layer met3    Track-Pitch = 0.6800  line-2-Via Pitch: 0.6150
[INFO GRT-0088] Layer met4    Track-Pitch = 0.9200  line-2-Via Pitch: 1.0400
[INFO GRT-0088] Layer met5    Track-Pitch = 3.4000  line-2-Via Pitch: 3.1100
[INFO GRT-0019] Found 10 clock nets.
[INFO GRT-0001] Minimum degree: 2
[INFO GRT-0002] Maximum degree: 21
[INFO GRT-0003] Macros: 0
[INFO GRT-0043] No OR_DEFAULT vias defined.
[INFO GRT-0004] Blockages: 1939

[INFO GRT-0053] Routing resources analysis:
          Routing      Original      Derated      Resource
Layer     Direction    Resources     Resources    Reduction (%)
---------------------------------------------------------------
li1        Vertical            0             0          0.00%
met1       Horizontal       7214          3372          53.26%
met2       Vertical         5610          3528          37.11%
met3       Horizontal       3598          2380          33.85%
met4       Vertical         2292          1393          39.22%
met5       Horizontal        716           340          52.51%
---------------------------------------------------------------

[INFO GRT-0197] Via related to pin nodes: 2844
[INFO GRT-0198] Via related Steiner nodes: 59
[INFO GRT-0199] Via filling finished.
[INFO GRT-0111] Final number of vias: 3473
[INFO GRT-0112] Final usage 3D: 12130

[INFO GRT-0096] Final congestion report:
Layer         Resource        Demand        Usage (%)    Max H / Max V / Total Overflow
---------------------------------------------------------------------------------------
li1                  0             0            0.00%             0 /  0 /  0
met1              3372           846           25.09%             0 /  0 /  0
met2              3528           842           23.87%             0 /  0 /  0
met3              2380             5            0.21%             0 /  0 /  0
met4              1393            18            1.29%             0 /  0 /  0
met5               340             0            0.00%             0 /  0 /  0
---------------------------------------------------------------------------------------
Total            11013          1711           15.54%             0 /  0 /  0

[INFO GRT-0018] Total wirelength: 20541 um
[INFO GRT-0014] Routed nets: 568
[INFO] Setting RC values…
Setting global connections for newly added cells…
[INFO] Setting global connections...
Updating metrics…
Cell type report:                       Count       Area
  Fill cell                                86     322.81
  Tap cell                                180     225.22
  Buffer                                    2       7.51
  Clock buffer                              9     225.22
  Timing Repair Buffer                    114     879.59
  Inverter                                 18      67.56
  Clock inverter                            7      71.32
  Sequential cell                         138    3465.82
  Multi-Input combinational cell          281    2250.91
  Total                                   835    7515.96
Writing OpenROAD database to '/home/kyouma-hououin/Documents/VLSI/verilog/adc_controller/librelane/runs/RUN_2025-12-06_20-03-52/41-openroad-repairantennas/1-diodeinsertion/spi_adc.odb'…
Writing layout to '/home/kyouma-hououin/Documents/VLSI/verilog/adc_controller/librelane/runs/RUN_2025-12-06_20-03-52/41-openroad-repairantennas/1-diodeinsertion/spi_adc.def'…
